### ISSUE TITLE
TimeWait  이슈 정리 

### ISSUE THREAD

**Issue by YeonjuOHYE** [YeonjuOHYE/network#2]
## 문제 상황

**1)무료 사용자 마이그레이션 스레드 증가에 따라 fips, dips, wlips 요청도 증가** 

**2)이 때, 다음과 같은 에러 발생** 
```
IPS_Invoker_Error_주소가 이미 사용 중입니다
```

**3)서버 설정 변경** 
```
* /etc/sysctl.conf
fs.file-max = 1000000
kernel.shmmax = 1073741824
kernel.sysrq = 0
 
net.core.netdev_max_backlog = 60000
net.core.rmem_max = 524288
net.core.somaxconn = 60000
net.core.wmem_max = 24288
 
net.ipv4.tcp_tw_reuse = 1
net.ipv4.tcp_tw_recycle = 0
net.ipv4.tcp_rmem = 4096 87380 16777216
net.ipv4.tcp_wmem = 4096 87380 16777216
net.ipv4.tcp_mem = 4096 87380 16777216
net.ipv4.tcp_keepalive_time = 1800
net.ipv4.tcp_max_syn_backlog = 32768
net.ipv4.tcp_max_tw_buckets = 2000000
net.ipv4.ip_local_port_range = 1024 65535
net.ipv4.tcp_syncookies = 0
 
 
* /etc/security/limits.conf
 
irteam soft nofile 1000000
irteam hard nofile 1000000
irteamsu soft nofile 1000000
irteamsu hard nofile 1000000
hadoop soft nofile 640000
hadoop hard nofile 640000
root soft nofile 1000000
root hard nofile 1000000
```
**4)그래도 발생....**
netstat 해서 보니 
```
[irteam@cbatch-esworker01.nphoto ~]$ netstat -tonp | grep TIME_WAIT | wc -l
47881
```
```
[irteam@cbatch-esworker01.nphoto ~]$ netstat -tonp | grep TIME_WAIT | grep 10.106.242.101 | wc -l
47204
```
대부분 10.106.242.101 (fips 서버) 에서 발생 

실시간 배치쪽에서도 마찬가지
```
[irteam@cvbat02.nphoto ~]$ netstat -tonp | grep TIME_WAIT | wc -l
13546
```
```
[irteam@cvbat02.nphoto ~]$ netstat -tonp | grep TIME_WAIT| grep "10.118.203.60"  | wc -l
8398
```
_10.118.203.60  한 서버 (fips, wips 서버)에서 대부분 발생_ 

**5)close 이슈 때문인가?**
<img width="778" alt="2019-05-07 4 19 49" src="https://media.oss.navercorp.com/user/4659/files/08e20e26-70e4-11e9-94e3-6368deff4932">
=> close 를 먼저 던지쪽이 TIME_WAIT을 가지게 됨

2분 동안 tcmdum 결과
```
2019-05-02 17:15:27.111487 IP 10.114.121.89.8986 > 10.106.242.101.80: S 2148280746:2148280746(0) win 5840 <mss 1460,sackOK,timestamp 2367952779 0,nop,wscale 9>
2019-05-02 17:15:27.111719 IP 10.106.242.101.80 > 10.114.121.89.26922: P 1:294(293) ack 514 win 122 <nop,nop,timestamp 459979840 2367952580>
2019-05-02 17:15:27.111725 IP 10.114.121.89.26922 > 10.106.242.101.80: . ack 294 win 14 <nop,nop,timestamp 2367952779 459979840>
2019-05-02 17:15:27.111767 IP 10.106.242.101.80 > 10.114.121.89.26922: F 294:294(0) ack 514 win 122 <nop,nop,timestamp 459979840 2367952580>
2019-05-02 17:15:27.111769 IP 10.114.121.89.26922 > 10.106.242.101.80: F 514:514(0) ack 294 win 14 <nop,nop,timestamp 2367952779 459979840>
2019-05-02 17:15:27.111773 IP 10.114.121.89.26922 > 10.106.242.101.80: . ack 295 win 14 <nop,nop,timestamp 2367952779 459979840>
2019-05-02 17:15:27.111952 IP 10.114.121.89.37499 > 10.106.242.101.80: S 3006115190:3006115190(0) win 5840 <mss 1460,sackOK,timestamp 2367952779 0,nop,wscale 9>
```
위의 결과를 토대로 배치 서버에서 active close(= 먼저  close를 보낸 경우)가 발생하여 TIME_WAIT이 발생하는 경우
분석
- 10.106.242.101 (fips) 
> 전체 : 57100
> 배치 서버에서 먼저 close  : 18620

- 10.118.105.118 (dips)
> 전체 : 98841
> 배치 서버에서 먼저 close  :57

_fips 요청의 대부분은  먼저 close를 날리고 있다_ 

**6)왜 fips에서 유독 active close 발생 ??**

fips(10.106.242.101), dips(10.118.105.118) 차이 

- dips  : nginx, chunked 
```
Hypertext Transfer Protocol
    HTTP/1.1 200 OK\r\n
        Request Version: HTTP/1.1
        Response Code: 200
    Server: nginx/1.6.0\r\n
    Date: Tue, 07 May 2019 15:12:26 GMT\r\n
    Transfer-Encoding: chunked\r\n
    Connection: close\r\n
    \r\n
    HTTP chunked response
        Data chunk (168 octets)
            Chunk size: 168 octets
            Data (168 bytes)
```

- fips  : Apache, Line-based text  
```
    HTTP/1.1 200 OK\r\n
        Request Version: HTTP/1.1
        Response Code: 200
    Date: Tue, 07 May 2019 15:12:33 GMT\r\n
    Server: Apache\r\n
    Accept-Ranges: bytes\r\n
    ResponseCode: 0\r\n
    Message: IPS_SUCCESS\r\n
    Retry: 0\r\n
    Content-Length: 79\r\n
        [Content length: 79]
    Connection: close\r\n
    Content-Type: application/json\r\n
    \r\n
Line-based text data: application/json
```

**7)위의 2)에서 TIME_WAIT을 재사용(tcp_reuse) 설정하였음으로 TIME_WAIT 이 발생하여도 위의 문제** 
```
[irteam@cbatch-esworker01.nphoto ~]$ netstat -ano | grep "timewait (0.00/0/0)" | wc -l
15306
```
[TIME_WAIT connections not being cleaned up after timeout period expires](https://serverfault.com/questions/303652/time-wait-connections-not-being-cleaned-up-after-timeout-period-expires)

('IPS_Invoker_Error_주소가 이미 사용 중입니다')가 발생하면 안된다. 
혹시 해당 설정이 제대로 적용되었나 확인하기 위해서 주성님께 확인
<img width="502" alt="2019-05-07 10 48 43" src="https://media.oss.navercorp.com/user/4659/files/cb9a3fd0-70b5-11e9-86bd-ab766bd92dac">

**8)혹시 빠진 설정이 있나**
so_reuseaddr 

참고  문서 [(link)](http://tech.kakao.com/2016/04/21/closewait-timewait/) server쪽에서만 의미있는 설정이라 
해서 1)설정에서 제외됨

![2019-05-09 10 51 36](https://media.oss.navercorp.com/user/4659/files/707a18a2-7248-11e9-8cce-6a8180cc6872)

**9)대안**
keep_alive를 사용

**Comment by YeonjuOHYE** [comment]
https://cnpnote.tistory.com/entry/SPRING-Spring-REST-%ED%85%9C%ED%94%8C%EB%A6%BF%EC%9D%84-%EC%82%AC%EC%9A%A9%ED%95%98%EC%97%AC-%EB%84%88%EB%AC%B4-%EB%A7%8E%EC%9D%80-%EC%97%B0%EA%B2%B0%EC%9D%84-%EB%A7%8C%EB%93%A4%EA%B1%B0%EB%82%98-%EB%8A%90%EB%A0%A4%EC%A7%84%EB%8B%A4
